{
  "schema_version": "q-demo.q3-parse-response.v1",
  "status": "NEEDS_CLARIFICATION",
  "reason": "CLOCK_MAPPING_MISSING",
  "reasons": [
    "CLOCK_MAPPING_MISSING"
  ],
  "resolved_scope": {
    "scene_id": "SCENE_SYN",
    "scene_revision": "rSYN",
    "run_ids": [
      "RUN_X"
    ],
    "clock_ids": null,
    "clock_mapping_sha256": null,
    "requested_time": null,
    "resolved_source_ranges_us": null,
    "time_coverage": null,
    "camera_ids": null,
    "detection_index_id": null,
    "detection_index_sha256": null,
    "region_graph_sha256": null,
    "camera_graph_sha256": null,
    "tracking_scope_sha256": null,
    "class_map_sha256": null,
    "color_method_version": null,
    "parameter_set_id": "pset:q-demo:43f151335b6ab2fe",
    "parameter_set_sha256": "43f151335b6ab2fe4fdeb9449f198e224127d3febaf9f099f324afb86c3a8142"
  },
  "identity_verdict": "UNCONFIRMED",
  "llm_parse_used": false,
  "agent_attempted": false,
  "agent_used": false,
  "decision_source": null,
  "fallback_used": false,
  "fallback_reason": null,
  "provenance": {
    "producer": "SYNTHETIC-producer",
    "producer_version": "0",
    "gt_read": false,
    "input_refs": [
      "index:SYNTHETIC"
    ]
  },
  "stats": {
    "latency_ms": {
      "total": 12
    }
  },
  "parsed_by": "RULE",
  "structured_query": null,
  "unresolved_terms": [],
  "clarification": {
    "question": "沒有時鐘對照，要用哪個時間基準？",
    "options": [
      "source"
    ]
  },
  "llm_call": null,
  "output_sha256": "ed3d8706614cc96f442a72a0c0a758dc85fd15b4f373429b2a047d636c5a35db"
}
